[
  {
    "id": "49290ce7-6c0d-4134-8ae3-1e3e2d7adee1",
    "from_id": "STR-2026-0625-001",
    "to_id": "STR-2026-0622-001",
    "type": "confirms",
    "rationale": "",
    "created": "2026-07-01T10:08:47.948633+00:00",
    "created_by": "migrate_relationships.py",
    "migrated_from": "links.*",
    "status": "active"
  },
  {
    "id": "ebbba9d9-5f67-439e-9ec6-d94108c18cdc",
    "from_id": "STR-2026-0625-001",
    "to_id": "STR-2026-0618-001",
    "type": "confirms",
    "rationale": "",
    "created": "2026-07-01T10:08:47.948696+00:00",
    "created_by": "migrate_relationships.py",
    "migrated_from": "links.*",
    "status": "active"
  },
  {
    "id": "d71cb4d1-5094-4d4e-97ee-f338831d5f03",
    "from_id": "STR-2026-0625-001",
    "to_id": "STR-2026-0623-001",
    "type": "confirms",
    "rationale": "",
    "created": "2026-07-01T10:08:47.948719+00:00",
    "created_by": "migrate_relationships.py",
    "migrated_from": "links.*",
    "status": "active"
  },
  {
    "id": "23e5a712-f852-48a1-a79a-5ad18012422d",
    "from_id": "STR-2026-0625-001",
    "to_id": "STR-2026-0624-002",
    "type": "confirms",
    "rationale": "",
    "created": "2026-07-01T10:08:47.948735+00:00",
    "created_by": "migrate_relationships.py",
    "migrated_from": "links.*",
    "status": "active"
  },
  {
    "id": "dee8c06d-137e-4a1c-bbd5-09f6571e6d2f",
    "from_id": "STR-2026-0625-001",
    "to_id": "STR-2026-0622-004",
    "type": "contradicts",
    "rationale": "",
    "created": "2026-07-01T10:08:47.948752+00:00",
    "created_by": "migrate_relationships.py",
    "migrated_from": "links.*",
    "status": "active"
  },
  {
    "id": "a9ac55ac-01b5-4a16-a8db-77ab0c7cefe9",
    "from_id": "STR-2026-0625-001",
    "to_id": "STR-2026-0622-003",
    "type": "contradicts",
    "rationale": "",
    "created": "2026-07-01T10:08:47.948768+00:00",
    "created_by": "migrate_relationships.py",
    "migrated_from": "links.*",
    "status": "active"
  },
  {
    "id": "8f5d8fcf-2bdf-40c8-944f-b6bcbfbf82d5",
    "from_id": "STR-2026-0625-001",
    "to_id": "STR-2026-0624-002",
    "type": "context_chain",
    "rationale": "",
    "created": "2026-07-01T10:08:47.948783+00:00",
    "created_by": "migrate_relationships.py",
    "migrated_from": "links.*",
    "status": "active"
  },
  {
    "id": "0a29434f-4823-463a-af83-f750ffb2da79",
    "from_id": "STR-2026-0625-001",
    "to_id": "STR-2026-0618-001",
    "type": "context_chain",
    "rationale": "",
    "created": "2026-07-01T10:08:47.948798+00:00",
    "created_by": "migrate_relationships.py",
    "migrated_from": "links.*",
    "status": "active"
  },
  {
    "id": "e7f35d1c-b8b7-413b-b487-00d77278f392",
    "from_id": "STR-2026-0619-001",
    "to_id": "STR-2026-0622-005",
    "type": "confirms",
    "rationale": "",
    "created": "2026-07-01T10:08:47.948816+00:00",
    "created_by": "migrate_relationships.py",
    "migrated_from": "links.*",
    "status": "active"
  },
  {
    "id": "f799e95a-6b21-43a8-bff8-ea12e3e8242f",
    "from_id": "STR-2026-0619-001",
    "to_id": "STR-2026-0616-001",
    "type": "contradicts",
    "rationale": "",
    "created": "2026-07-01T10:08:47.948831+00:00",
    "created_by": "migrate_relationships.py",
    "migrated_from": "links.*",
    "status": "active"
  },
  {
    "id": "70361e2c-2a85-4b88-9ec8-65c546fdacdf",
    "from_id": "STR-2026-0619-001",
    "to_id": "STR-2026-0618-002",
    "type": "contradicts",
    "rationale": "",
    "created": "2026-07-01T10:08:47.948845+00:00",
    "created_by": "migrate_relationships.py",
    "migrated_from": "links.*",
    "status": "active"
  },
  {
    "id": "c9b12114-7c6a-4f92-a9b5-17bb21343f69",
    "from_id": "STR-2026-0619-001",
    "to_id": "STR-2026-0622-005",
    "type": "context_chain",
    "rationale": "",
    "created": "2026-07-01T10:08:47.948860+00:00",
    "created_by": "migrate_relationships.py",
    "migrated_from": "links.*",
    "status": "active"
  },
  {
    "id": "f57248b9-a526-4c5a-88f2-28ac03f6fc72",
    "from_id": "STR-2026-0616-001",
    "to_id": "STR-2026-0618-002",
    "type": "confirms",
    "rationale": "",
    "created": "2026-07-01T10:08:47.948876+00:00",
    "created_by": "migrate_relationships.py",
    "migrated_from": "links.*",
    "status": "active"
  },
  {
    "id": "f44ee0f8-82fb-4041-a344-4650fa7a73fa",
    "from_id": "STR-2026-0616-001",
    "to_id": "STR-2026-0620-001",
    "type": "confirms",
    "rationale": "",
    "created": "2026-07-01T10:08:47.948890+00:00",
    "created_by": "migrate_relationships.py",
    "migrated_from": "links.*",
    "status": "active"
  },
  {
    "id": "4dbee778-2f0b-465c-a527-e359bb6a4c5c",
    "from_id": "STR-2026-0616-001",
    "to_id": "STR-2026-0622-005",
    "type": "contradicts",
    "rationale": "",
    "created": "2026-07-01T10:08:47.948905+00:00",
    "created_by": "migrate_relationships.py",
    "migrated_from": "links.*",
    "status": "active"
  },
  {
    "id": "d567a2f3-074e-45e0-a928-a9a4acef01e1",
    "from_id": "STR-2026-0616-001",
    "to_id": "STR-2026-0618-002",
    "type": "context_chain",
    "rationale": "",
    "created": "2026-07-01T10:08:47.948920+00:00",
    "created_by": "migrate_relationships.py",
    "migrated_from": "links.*",
    "status": "active"
  },
  {
    "id": "dcdbb42b-be4f-42f5-ab1e-42c485c8a714",
    "from_id": "STR-2026-0623-002",
    "to_id": "STR-2026-0622-003",
    "type": "confirms",
    "rationale": "",
    "created": "2026-07-01T10:08:47.948935+00:00",
    "created_by": "migrate_relationships.py",
    "migrated_from": "links.*",
    "status": "active"
  },
  {
    "id": "93b368b2-34a3-476e-bc78-1256bb1c27c3",
    "from_id": "STR-2026-0623-002",
    "to_id": "STR-2026-0620-001",
    "type": "confirms",
    "rationale": "",
    "created": "2026-07-01T10:08:47.948951+00:00",
    "created_by": "migrate_relationships.py",
    "migrated_from": "links.*",
    "status": "active"
  },
  {
    "id": "5b483999-0edf-4e0a-b962-49b1d60b98d0",
    "from_id": "STR-2026-0623-002",
    "to_id": "STR-2026-0623-001",
    "type": "contradicts",
    "rationale": "",
    "created": "2026-07-01T10:08:47.948966+00:00",
    "created_by": "migrate_relationships.py",
    "migrated_from": "links.*",
    "status": "active"
  },
  {
    "id": "9c24f657-fd95-43dd-9bd1-7ab8ea484c39",
    "from_id": "STR-2026-0623-002",
    "to_id": "STR-2026-0618-002",
    "type": "context_chain",
    "rationale": "",
    "created": "2026-07-01T10:08:47.948983+00:00",
    "created_by": "migrate_relationships.py",
    "migrated_from": "links.*",
    "status": "active"
  },
  {
    "id": "652fdb1a-a2d4-4589-9d5f-91f33e675541",
    "from_id": "STR-2026-0623-001",
    "to_id": "STR-2026-0622-001",
    "type": "confirms",
    "rationale": "",
    "created": "2026-07-01T10:08:47.949001+00:00",
    "created_by": "migrate_relationships.py",
    "migrated_from": "links.*",
    "status": "active"
  },
  {
    "id": "2e2aa469-bdc5-4d42-afa2-2eb2b9aea4cd",
    "from_id": "STR-2026-0623-001",
    "to_id": "STR-2026-0618-001",
    "type": "confirms",
    "rationale": "",
    "created": "2026-07-01T10:08:47.949016+00:00",
    "created_by": "migrate_relationships.py",
    "migrated_from": "links.*",
    "status": "active"
  },
  {
    "id": "7fac31f7-994d-48e8-a5ab-f125cba2cb31",
    "from_id": "STR-2026-0623-001",
    "to_id": "STR-2026-0622-004",
    "type": "contradicts",
    "rationale": "",
    "created": "2026-07-01T10:08:47.949030+00:00",
    "created_by": "migrate_relationships.py",
    "migrated_from": "links.*",
    "status": "retracted",
    "retracted": "2026-07-04T18:30:33.797700+00:00",
    "retracted_by": "analyst",
    "retraction_rationale": "Тест BAMS Р7: оба сигнала истинны одновременно (смена аллокации капитала vs расхождение заявлений менеджмента/рынка) — не взаимоисключающие состояния. Ретрактировано при ревизии contradiction cycles 2026-07-04."
  },
  {
    "id": "e5f308ec-b273-4a81-b26e-15bf69f4c1cd",
    "from_id": "STR-2026-0623-001",
    "to_id": "STR-2026-0622-003",
    "type": "context_chain",
    "rationale": "",
    "created": "2026-07-01T10:08:47.949133+00:00",
    "created_by": "migrate_relationships.py",
    "migrated_from": "links.*",
    "status": "active"
  },
  {
    "id": "cd09af22-1ecd-4370-9cd0-5e122caf2a2d",
    "from_id": "STR-2026-0623-001",
    "to_id": "STR-2026-0615-001",
    "type": "context_chain",
    "rationale": "",
    "created": "2026-07-01T10:08:47.949155+00:00",
    "created_by": "migrate_relationships.py",
    "migrated_from": "links.*",
    "status": "active"
  },
  {
    "id": "439e3a82-6bf9-40d3-8be6-590b9757ef1f",
    "from_id": "STR-2026-0622-001",
    "to_id": "STR-2026-0618-001",
    "type": "confirms",
    "rationale": "",
    "created": "2026-07-01T10:08:47.949175+00:00",
    "created_by": "migrate_relationships.py",
    "migrated_from": "links.*",
    "status": "active"
  },
  {
    "id": "c83a3140-a840-4cc2-8741-f734a17f6d75",
    "from_id": "STR-2026-0622-001",
    "to_id": "STR-2026-0622-004",
    "type": "contradicts",
    "rationale": "",
    "created": "2026-07-01T10:08:47.949196+00:00",
    "created_by": "migrate_relationships.py",
    "migrated_from": "links.*",
    "status": "retracted",
    "retracted": "2026-07-04T18:30:33.797700+00:00",
    "retracted_by": "analyst",
    "retraction_rationale": "Тест BAMS Р7: описывают один и тот же факт (NAV-дисконт 0.83x) под разными углами, не несовместимые состояния — переклассифицировано в context_chain. Ретрактировано при ревизии contradiction cycles 2026-07-04."
  },
  {
    "id": "2c11edab-d4e2-40a0-8435-30ec0b642fa6",
    "from_id": "STR-2026-0622-001",
    "to_id": "STR-2026-0616-001",
    "type": "context_chain",
    "rationale": "",
    "created": "2026-07-01T10:08:47.949211+00:00",
    "created_by": "migrate_relationships.py",
    "migrated_from": "links.*",
    "status": "active"
  },
  {
    "id": "a8b7b5e2-07b0-4b4b-9a78-729e7bdaf471",
    "from_id": "STR-2026-0615-001",
    "to_id": "STR-2026-0622-004",
    "type": "confirms",